{
  "schema_id": "simai.framework.release-lock",
  "schema_version": 1,
  "compatibility_id": "ui-8a10db6eeadc-smart-67238a8121b3",
  "status": "bounded",
  "profile": "plain-assets-v1",
  "runtime_sources": {
    "ui": {
      "owner": "simai/ui",
      "tag": null,
      "tag_object": null,
      "commit": "8a10db6eeadc7a6cd1f2af6c23d5574cf5af1149",
      "tree": "af738b34168d66aed1c059d92c1acf491c7f4306",
      "runtime_path": "distr",
      "runtime_tree": "54aae7a25cd066b9da459da1b1f402a179eb035b",
      "archive_sha256": "6edce32fd3fb5e9876107fcca6223dbbccfb2a4250de3c953e63337937e0a7ef"
    },
    "ui-smart": {
      "owner": "simai/ui-smart",
      "tag": null,
      "tag_object": null,
      "commit": "67238a8121b3df17223f6e8dd54d2e301161a888",
      "tree": "7ced4cfe379421846a7ff86187119d7e5d60ea39",
      "runtime_path": "smart",
      "runtime_tree": "8e58d4c4d11458d3d14be7e4b6bb9e40b83a3362",
      "archive_sha256": "a13c0eba6dc3a44e0b784bc1522c3bc43f05aa0ef749bca7f258a1d675f709c1"
    }
  },
  "build_inputs": {
    "source": {
      "owner": "simai/ui-source",
      "commit": "6603babb81da51a5c8c0491cc8b3e0da0b236902",
      "tree": "eb656c489190b1512c276141d270a60fdb344964",
      "archive_sha256": "899d89c3262504848c6006c44bc7c8d1b391808c22f00976cbbf2fdaf1e4837a"
    },
    "builder": {
      "owner": "simai/ui-builder",
      "commit": "d805a72a6c9191a97d2ebd8b86899bf2f25a2e93",
      "tree": "dd2c4e8fb38cd2c248aa8a47a279a91964754691",
      "archive_sha256": "34d8edd71ebef2508c099aab5626c37a6ebb171497cc607765a25f5e713e6d9f"
    },
    "legacy_compatibility": {
      "required": false
    }
  },
  "inventory": {
    "utility_rules": 729,
    "utility_families": 227,
    "components": 61,
    "smart_components": 44,
    "recipes": 1
  },
  "exclusions": [],
  "claims": {
    "full_compatible": false,
    "production_ready": false,
    "all_items_ready": false
  }
}
