{
  "schema_id": "simai.framework.release-lock",
  "schema_version": 1,
  "compatibility_id": "ui-f92c9c211bb4-smart-6f2ee779feb8",
  "status": "bounded",
  "profile": "plain-assets-v1",
  "runtime_sources": {
    "ui": {
      "owner": "simai/ui",
      "tag": null,
      "tag_object": null,
      "commit": "f92c9c211bb45f8d4312b3c3c9db70afa34a0910",
      "tree": "3f961076d2ed0cd8015df4579dff6aa2008dddb9",
      "runtime_path": "distr",
      "runtime_tree": "ba9f765b12f9118ca2f82e7a9a8ba6f85814d179",
      "archive_sha256": "b484a759110b236a0f83f8f7a029d26b0a138f9760e9e50ac48eb137a0322606"
    },
    "ui-smart": {
      "owner": "simai/ui-smart",
      "tag": null,
      "tag_object": null,
      "commit": "6f2ee779feb8979d1eb3f7a19cec8263e8f18887",
      "tree": "59b6857425e52d7e0669618d2b57410db1a63e0f",
      "runtime_path": "smart",
      "runtime_tree": "33347af43eb98009f8e7fe95a223b3d3dbf9d907",
      "archive_sha256": "ecf0ecc4ea453df6201ca2e0a6e16122a356bda4bdc215720acd39e5615f271a"
    }
  },
  "build_inputs": {
    "source": {
      "owner": "simai/ui-source",
      "commit": "b77263f878f23d027d8466c628aa1f54fe17a17a",
      "tree": "931ebaf9f523acf1ecbd71059971b23ca2bbdb9a",
      "archive_sha256": "f5cc14f51b372a81a87df6498651b8960b441da085b17aaad4872205cd860cbf"
    },
    "builder": {
      "owner": "simai/ui-builder",
      "commit": "d805a72a6c9191a97d2ebd8b86899bf2f25a2e93",
      "tree": "dd2c4e8fb38cd2c248aa8a47a279a91964754691",
      "archive_sha256": "34d8edd71ebef2508c099aab5626c37a6ebb171497cc607765a25f5e713e6d9f"
    },
    "legacy_compatibility": {
      "required": false
    }
  },
  "inventory": {
    "utility_rules": 729,
    "utility_families": 227,
    "components": 61,
    "smart_components": 44,
    "recipes": 1
  },
  "exclusions": [],
  "claims": {
    "full_compatible": false,
    "production_ready": false,
    "all_items_ready": false
  }
}
