{
  "schema_id": "simai.framework.release-lock",
  "schema_version": 1,
  "compatibility_id": "ui-eb6661c20f75-smart-6294f3d9191d",
  "status": "bounded",
  "profile": "plain-assets-v1",
  "runtime_sources": {
    "ui": {
      "owner": "simai/ui",
      "tag": null,
      "tag_object": null,
      "commit": "eb6661c20f758cc94d58f86aa365da44470f1514",
      "tree": "80c32ee47073ff4fb5176d39d96422218474d8db",
      "runtime_path": "distr",
      "runtime_tree": "4819b2f97db20e1c674e3d87b0a6a412c4d3b70a",
      "archive_sha256": "10e742e804cd4a33f479b88bca7c1fd942b1f01d3c865036569528eb8c391444"
    },
    "ui-smart": {
      "owner": "simai/ui-smart",
      "tag": null,
      "tag_object": null,
      "commit": "6294f3d9191d6f2a88d70677dedd43ebac4af81f",
      "tree": "b853f6510f858a5cc4b1ba9da995171f7f9246fe",
      "runtime_path": "smart",
      "runtime_tree": "80fbe8877b120d608d89e5a650f1418e4a1d7613",
      "archive_sha256": "ea7190e9947350ab1cf6dc5d03b6a6ad4dd2f3ff31462234e9270250c62851ce"
    }
  },
  "build_inputs": {
    "source": {
      "owner": "simai/ui-source",
      "commit": "5f3c3810628fc8fbd194882c1d0c29ccc593ea0f",
      "tree": "b47bd33a03d8c25ce434ee17c05ebd64caa669b3",
      "archive_sha256": "f6a466d8cc4ee1469c7e64fc29d190dfc37688c511c65a474f20ee5f539520b5"
    },
    "builder": {
      "owner": "simai/ui-builder",
      "commit": "d805a72a6c9191a97d2ebd8b86899bf2f25a2e93",
      "tree": "dd2c4e8fb38cd2c248aa8a47a279a91964754691",
      "archive_sha256": "34d8edd71ebef2508c099aab5626c37a6ebb171497cc607765a25f5e713e6d9f"
    },
    "legacy_compatibility": {
      "required": false
    }
  },
  "inventory": {
    "utility_rules": 729,
    "utility_families": 227,
    "components": 61,
    "smart_components": 44,
    "recipes": 1
  },
  "exclusions": [],
  "claims": {
    "full_compatible": false,
    "production_ready": false,
    "all_items_ready": false
  }
}
