{
  "schema_id": "simai.framework.release-lock",
  "schema_version": 1,
  "compatibility_id": "ui-9e39b9930557-smart-6b548fc03379",
  "status": "bounded",
  "profile": "plain-assets-v1",
  "runtime_sources": {
    "ui": {
      "owner": "simai/ui",
      "tag": null,
      "tag_object": null,
      "commit": "9e39b9930557ce1ea1ab2be63617616e25bca110",
      "tree": "97ffe12bfa745bbab1eec720e27fd52160be87d2",
      "runtime_path": "distr",
      "runtime_tree": "9041fd2780de07b2c8084ddf5cb85328865f0ca4",
      "archive_sha256": "9600aba6e5144e0af160f34a510970f0d92f1c566235d815eb26c8c2ae8476ad"
    },
    "ui-smart": {
      "owner": "simai/ui-smart",
      "tag": null,
      "tag_object": null,
      "commit": "6b548fc03379fb2ef1aae452269d977075a834bc",
      "tree": "07449ecba68159365fbc78bf46f6ea9552f0884e",
      "runtime_path": "smart",
      "runtime_tree": "ab84221a49c1af7a1fd0b31974b9075fcd31af13",
      "archive_sha256": "204387dae65c0b9bdfe1354187af6644e679ba1dff8f08f1c32f23bbe5e4da4c"
    }
  },
  "build_inputs": {
    "source": {
      "owner": "simai/ui-source",
      "commit": "14570189b62a9d82f7f77148a018e014a2382007",
      "tree": "9336f167f9b31fe03a52edc9e83965d7792e41c5",
      "archive_sha256": "525fcac7018b85ad8b30cffd2830fc002a4e2727c93af4e4871aaeed20b0e6c8"
    },
    "builder": {
      "owner": "simai/ui-builder",
      "commit": "d805a72a6c9191a97d2ebd8b86899bf2f25a2e93",
      "tree": "dd2c4e8fb38cd2c248aa8a47a279a91964754691",
      "archive_sha256": "34d8edd71ebef2508c099aab5626c37a6ebb171497cc607765a25f5e713e6d9f"
    },
    "legacy_compatibility": {
      "required": false
    }
  },
  "inventory": {
    "utility_rules": 729,
    "utility_families": 227,
    "components": 61,
    "smart_components": 44,
    "recipes": 1
  },
  "exclusions": [],
  "claims": {
    "full_compatible": false,
    "production_ready": false,
    "all_items_ready": false
  }
}
