{
  "schema_id": "simai.framework.release-lock",
  "schema_version": 1,
  "compatibility_id": "ui-96ae20b6bcd7-smart-7e6cd9575028",
  "status": "bounded",
  "profile": "plain-assets-v1",
  "runtime_sources": {
    "ui": {
      "owner": "simai/ui",
      "tag": null,
      "tag_object": null,
      "commit": "96ae20b6bcd7e1635dc75f3bc8f2fc73a550f562",
      "tree": "71c6c05d985f23d8bf670d22d0fb83d85d23e5ac",
      "runtime_path": "distr",
      "runtime_tree": "ede57a4628be7dbf8960c26d65818ea5aec3439c",
      "archive_sha256": "037ad1c06d30540defb4c576caf30a9ffcaf8cf2ab8371fdfbd3758fab973c70"
    },
    "ui-smart": {
      "owner": "simai/ui-smart",
      "tag": null,
      "tag_object": null,
      "commit": "7e6cd95750285aa203a038a15a2529ec11a7572b",
      "tree": "6271bf8c4834ff3e1375a07be434b9ad5a32b5e8",
      "runtime_path": "smart",
      "runtime_tree": "d393f29fc05d7e6e31f008e6341f68a27eb78860",
      "archive_sha256": "97c179bfc2c5b55082910d85bf5888bfe872763b55115bb5324b0d7c10791b64"
    }
  },
  "build_inputs": {
    "source": {
      "owner": "simai/ui-source",
      "commit": "9951d6bf62b216265b0c565905c6feef881a138b",
      "tree": "efc3b057be54d521ddba52f5af1fc2cbc282fd7f",
      "archive_sha256": "6cb83055e3cfae8f62bfae74935720ea3332d67376989b653071ed2958af25f6"
    },
    "builder": {
      "owner": "simai/ui-builder",
      "commit": "d805a72a6c9191a97d2ebd8b86899bf2f25a2e93",
      "tree": "dd2c4e8fb38cd2c248aa8a47a279a91964754691",
      "archive_sha256": "34d8edd71ebef2508c099aab5626c37a6ebb171497cc607765a25f5e713e6d9f"
    },
    "legacy_compatibility": {
      "required": false
    }
  },
  "inventory": {
    "utility_rules": 729,
    "utility_families": 227,
    "components": 61,
    "smart_components": 44,
    "recipes": 1
  },
  "exclusions": [],
  "claims": {
    "full_compatible": false,
    "production_ready": false,
    "all_items_ready": false
  }
}
