{
  "schema_id": "simai.framework.release-lock",
  "schema_version": 1,
  "compatibility_id": "ui-af6287f59202-smart-04000997b446",
  "status": "bounded",
  "profile": "plain-assets-v1",
  "runtime_sources": {
    "ui": {
      "owner": "simai/ui",
      "tag": null,
      "tag_object": null,
      "commit": "af6287f59202f5a5faca94a571b9d7f69e2f7262",
      "tree": "9f7bf6123cc00183987a9fdb528a03e0e5910b5c",
      "runtime_path": "distr",
      "runtime_tree": "14b8052ff5e38622198aed735fa60bf407e536b4",
      "archive_sha256": "e40305eeb01dd4ec6292afc2d438d7320c709f0b0a4d4cc1e996451adaef6790"
    },
    "ui-smart": {
      "owner": "simai/ui-smart",
      "tag": null,
      "tag_object": null,
      "commit": "04000997b4467e13d66ef3bde8a57cc4ef3c0f3d",
      "tree": "2f969422c58208f952a8d00dd3a06009df242a41",
      "runtime_path": "smart",
      "runtime_tree": "9cdef6a53bc0b688f9e7ab46f61522221cd88eff",
      "archive_sha256": "b57906a615c4ec6fbb6294057f212413425bbb30a98aca038ef0592b4ed59f26"
    }
  },
  "build_inputs": {
    "source": {
      "owner": "simai/ui-source",
      "commit": "3372ccf096a349f70668641684f0fd6e47b7fd4b",
      "tree": "f20eebb617def80dfb554b8774d802255a59e84a",
      "archive_sha256": "649c454c1922fdc60ac09199969787763ae43632e68907a0de1da57b564dc14a"
    },
    "builder": {
      "owner": "simai/ui-builder",
      "commit": "d805a72a6c9191a97d2ebd8b86899bf2f25a2e93",
      "tree": "dd2c4e8fb38cd2c248aa8a47a279a91964754691",
      "archive_sha256": "34d8edd71ebef2508c099aab5626c37a6ebb171497cc607765a25f5e713e6d9f"
    },
    "legacy_compatibility": {
      "required": false
    }
  },
  "inventory": {
    "utility_rules": 729,
    "utility_families": 227,
    "components": 61,
    "smart_components": 44,
    "recipes": 1
  },
  "exclusions": [],
  "claims": {
    "full_compatible": false,
    "production_ready": false,
    "all_items_ready": false
  }
}
