{
  "schema_id": "simai.framework.release-lock",
  "schema_version": 1,
  "compatibility_id": "ui-067b0440d41f-smart-a3ae57119357",
  "status": "bounded",
  "profile": "plain-assets-v1",
  "runtime_sources": {
    "ui": {
      "owner": "simai/ui",
      "tag": null,
      "tag_object": null,
      "commit": "067b0440d41f2d0357cbeb583b49a0010c63d939",
      "tree": "6df5c493cc9d674a6078aff7a4adb25c661edb24",
      "runtime_path": "distr",
      "runtime_tree": "9a368c0033eaadb0b0f37c24ffb310200869101c",
      "archive_sha256": "f32b5d4395176164c858ca7a678a25ae78e26e55870de04dffd768fd2228cac0"
    },
    "ui-smart": {
      "owner": "simai/ui-smart",
      "tag": null,
      "tag_object": null,
      "commit": "a3ae571193571b4f552e715ac2e3c4caa4e2582a",
      "tree": "57b9341b829a502704206aab0a5106335dda6981",
      "runtime_path": "smart",
      "runtime_tree": "c3f219e2748881e280133a38eaad5e1c96dd2241",
      "archive_sha256": "eb414509c7044f81a8d40491e2133178828e87955ef348843ed3759de5df73b6"
    }
  },
  "build_inputs": {
    "source": {
      "owner": "simai/ui-source",
      "commit": "778bf428e7e60b5510810858c45af1d05dd32154",
      "tree": "91ff0b7dbd88aa28b0eabfb8f66739f6d3d75876",
      "archive_sha256": "ed45ffd6a9d940598caee05dc0593f3373b279df58bfc873766e5ff6b18d2529"
    },
    "builder": {
      "owner": "simai/ui-builder",
      "commit": "d805a72a6c9191a97d2ebd8b86899bf2f25a2e93",
      "tree": "dd2c4e8fb38cd2c248aa8a47a279a91964754691",
      "archive_sha256": "34d8edd71ebef2508c099aab5626c37a6ebb171497cc607765a25f5e713e6d9f"
    },
    "legacy_compatibility": {
      "required": false
    }
  },
  "inventory": {
    "utility_rules": 729,
    "utility_families": 227,
    "components": 61,
    "smart_components": 44,
    "recipes": 1
  },
  "exclusions": [],
  "claims": {
    "full_compatible": false,
    "production_ready": false,
    "all_items_ready": false
  }
}
