{
  "schema_id": "simai.framework.release-lock",
  "schema_version": 1,
  "compatibility_id": "ui-f36cee75e553-smart-ae58fee26055",
  "status": "bounded",
  "profile": "plain-assets-v1",
  "runtime_sources": {
    "ui": {
      "owner": "simai/ui",
      "tag": null,
      "tag_object": null,
      "commit": "f36cee75e553efbc2cf18a652c488445c8fed691",
      "tree": "417f8cf4199a2c1af795e500c2600fcfba6601d6",
      "runtime_path": "distr",
      "runtime_tree": "e9802797f2342f9335deb4ca6f7bfb642aaffa77",
      "archive_sha256": "7a0bf9518e7fa0209743965406eb1041ae17825bec147660ec78dab1aa2aae9e"
    },
    "ui-smart": {
      "owner": "simai/ui-smart",
      "tag": null,
      "tag_object": null,
      "commit": "ae58fee2605585a61bf6f0f7e974f532914e34a0",
      "tree": "7ddb0cb4f023b1c4d70e7711508c6f1a4552a464",
      "runtime_path": "smart",
      "runtime_tree": "c427a95c6bbc27c4e41fde184ccacd742dc59f0d",
      "archive_sha256": "280e2d2a3144c26bd7cbddba49d430721ebfc38629498421c08a0fdce0ae9434"
    }
  },
  "build_inputs": {
    "source": {
      "owner": "simai/ui-source",
      "commit": "0ba80ed6d0303935e401d99ce6bf1e02104993bb",
      "tree": "a373bda29b4a1f904e1754ae25a729dba4ed4de9",
      "archive_sha256": "12fdec4f80c4dc331a35423e5b03eee8bf4ac1f27332ea553804de61e1ad412c"
    },
    "builder": {
      "owner": "simai/ui-builder",
      "commit": "d805a72a6c9191a97d2ebd8b86899bf2f25a2e93",
      "tree": "dd2c4e8fb38cd2c248aa8a47a279a91964754691",
      "archive_sha256": "34d8edd71ebef2508c099aab5626c37a6ebb171497cc607765a25f5e713e6d9f"
    },
    "legacy_compatibility": {
      "required": false
    }
  },
  "inventory": {
    "utility_rules": 729,
    "utility_families": 227,
    "components": 61,
    "smart_components": 44,
    "recipes": 1
  },
  "exclusions": [],
  "claims": {
    "full_compatible": false,
    "production_ready": false,
    "all_items_ready": false
  }
}
