{
  "schema_id": "simai.framework.release-lock",
  "schema_version": 1,
  "compatibility_id": "ui-06611e42e519-smart-e7eab9675c56",
  "status": "bounded",
  "profile": "plain-assets-v1",
  "runtime_sources": {
    "ui": {
      "owner": "simai/ui",
      "tag": null,
      "tag_object": null,
      "commit": "06611e42e51996e6633f95cd92a1af62f7bf804e",
      "tree": "af3027b0f831c842ba17b226a03a792aba89a8a4",
      "runtime_path": "distr",
      "runtime_tree": "197058a23a3b7d7045f8c0c03df067009ae0805c",
      "archive_sha256": "90b1f1ea28bd7bea4af01dc7f85c0f8470f03497b9fd9b6befe55fd48d7b36f4"
    },
    "ui-smart": {
      "owner": "simai/ui-smart",
      "tag": null,
      "tag_object": null,
      "commit": "e7eab9675c56bbfc2613670e0311a9daff3afd12",
      "tree": "cf4372dff6a1338c562e518cf367684baa9afc55",
      "runtime_path": "smart",
      "runtime_tree": "dd6c5af6cfc1bf7b30741cb0e40fd7d8ff9e3f04",
      "archive_sha256": "ff1b8ff40abf027b2f23afc51c190a58dafe52ee7fa4d39f335c3043fb331896"
    }
  },
  "build_inputs": {
    "source": {
      "owner": "simai/ui-source",
      "commit": "2f25ff479ea8db3988a379faf23cf8a055a2e158",
      "tree": "1a8f9fbf85414bf5304e4fe1b6a84a70bbb8964c",
      "archive_sha256": "3a9a90ab9a5dba78307739fb14bbd7275b66127c13c56ba6dd3cccbbaf0e6f3e"
    },
    "builder": {
      "owner": "simai/ui-builder",
      "commit": "d805a72a6c9191a97d2ebd8b86899bf2f25a2e93",
      "tree": "dd2c4e8fb38cd2c248aa8a47a279a91964754691",
      "archive_sha256": "34d8edd71ebef2508c099aab5626c37a6ebb171497cc607765a25f5e713e6d9f"
    },
    "legacy_compatibility": {
      "required": false
    }
  },
  "inventory": {
    "utility_rules": 729,
    "utility_families": 227,
    "components": 61,
    "smart_components": 44,
    "recipes": 1
  },
  "exclusions": [],
  "claims": {
    "full_compatible": false,
    "production_ready": false,
    "all_items_ready": false
  }
}
