{
  "schema_id": "simai.framework.release-lock",
  "schema_version": 1,
  "compatibility_id": "ui-a07b5100fdee-smart-9aacd94f40be",
  "status": "bounded",
  "profile": "plain-assets-v1",
  "runtime_sources": {
    "ui": {
      "owner": "simai/ui",
      "tag": null,
      "tag_object": null,
      "commit": "a07b5100fdee160b2d14d4879abece0d1fac858b",
      "tree": "f80fea4a3fc3b3b49bbe3fd4a1d97e50ccb39239",
      "runtime_path": "distr",
      "runtime_tree": "02c0cecd50a465d641f9f4fe810e0118bd25d8b1",
      "archive_sha256": "76df0f945e3f500236d53b46199a0327645ddf23c48c9f73281b7ae5cf860d8e"
    },
    "ui-smart": {
      "owner": "simai/ui-smart",
      "tag": null,
      "tag_object": null,
      "commit": "9aacd94f40beda9df4ce0717b36e3adc2f6deb17",
      "tree": "b5a852e1debb7048905bac8d657207fcb5f1cff2",
      "runtime_path": "smart",
      "runtime_tree": "316c8218b7726cf8c01660fee0e5a1c95bf86fc3",
      "archive_sha256": "a191a2816a2f13f9dadd271fc905219f340207a3d0885442e400cf20bab8cff3"
    }
  },
  "build_inputs": {
    "source": {
      "owner": "simai/ui-source",
      "commit": "8c5986ed3d56ae2396be3ecd9a512a8019b4915f",
      "tree": "40a7eb9c3c79f6a4c1524670700a7d32f080562c",
      "archive_sha256": "132bfb2119b5f708b52b929dbd9327232efa49617e2df11921da3e27b9e69f8d"
    },
    "builder": {
      "owner": "simai/ui-builder",
      "commit": "d805a72a6c9191a97d2ebd8b86899bf2f25a2e93",
      "tree": "dd2c4e8fb38cd2c248aa8a47a279a91964754691",
      "archive_sha256": "34d8edd71ebef2508c099aab5626c37a6ebb171497cc607765a25f5e713e6d9f"
    },
    "legacy_compatibility": {
      "required": false
    }
  },
  "inventory": {
    "utility_rules": 729,
    "utility_families": 227,
    "components": 61,
    "smart_components": 44,
    "recipes": 1
  },
  "exclusions": [],
  "claims": {
    "full_compatible": false,
    "production_ready": false,
    "all_items_ready": false
  }
}
