{
  "schema_id": "simai.framework.release-lock",
  "schema_version": 1,
  "compatibility_id": "ui-7e13732dc09f-smart-c80a0f2e441b",
  "status": "bounded",
  "profile": "plain-assets-v1",
  "runtime_sources": {
    "ui": {
      "owner": "simai/ui",
      "tag": null,
      "tag_object": null,
      "commit": "7e13732dc09fddf9ebf939b2b460951a0abb8283",
      "tree": "caf86b5781bcc452aa6807e147b345eba9e6f589",
      "runtime_path": "distr",
      "runtime_tree": "a2d57dda5be440540ca80d2b242ba9b14c677e7d",
      "archive_sha256": "a5f07abfe64a33a5607ceabaa4f0dc77a23a6dae16aaab7ddc8e7c4733653b4d"
    },
    "ui-smart": {
      "owner": "simai/ui-smart",
      "tag": null,
      "tag_object": null,
      "commit": "c80a0f2e441b5739fe8474ea3cc9569699d5b44b",
      "tree": "1e9f6555e4c0aeb4402c0674291c0b685f770d45",
      "runtime_path": "smart",
      "runtime_tree": "b13b3f7b0e57610c8aec43e723f4aaf35b4a1a2b",
      "archive_sha256": "26d1d2a2cc75d1ad05a9474adc8d45536a15221bb8a863d14c10de0426b8d981"
    }
  },
  "build_inputs": {
    "source": {
      "owner": "simai/ui-source",
      "commit": "9032b632ab378cc6d8e0d358e78ade78209b8b6a",
      "tree": "658fbcc3a6b68cc4118a13419f2aad1ff7f17282",
      "archive_sha256": "af56f764359ce3b2242b76bece4b951468473153da0bc2aed0c13b71ea9f0cef"
    },
    "builder": {
      "owner": "simai/ui-builder",
      "commit": "d805a72a6c9191a97d2ebd8b86899bf2f25a2e93",
      "tree": "dd2c4e8fb38cd2c248aa8a47a279a91964754691",
      "archive_sha256": "34d8edd71ebef2508c099aab5626c37a6ebb171497cc607765a25f5e713e6d9f"
    },
    "legacy_compatibility": {
      "required": false
    }
  },
  "inventory": {
    "utility_rules": 729,
    "utility_families": 227,
    "components": 61,
    "smart_components": 44,
    "recipes": 1
  },
  "exclusions": [],
  "claims": {
    "full_compatible": false,
    "production_ready": false,
    "all_items_ready": false
  }
}
