{
  "schema_id": "simai.framework.release-lock",
  "schema_version": 1,
  "compatibility_id": "ui-e27c1c45c315-smart-b8322de1ead6",
  "status": "bounded",
  "profile": "plain-assets-v1",
  "runtime_sources": {
    "ui": {
      "owner": "simai/ui",
      "tag": null,
      "tag_object": null,
      "commit": "e27c1c45c31596ea054be50cc69c13785fae47d4",
      "tree": "d1de7050501253c31ff47802c71a9b59b5963ec5",
      "runtime_path": "distr",
      "runtime_tree": "d44e0cb4a0b03a76a42a758f6feec6771b85c17a",
      "archive_sha256": "82bf51c8d3f14ae3d194ecdfda90ac418e71dc5ff10ef0f1706babfc880e092f"
    },
    "ui-smart": {
      "owner": "simai/ui-smart",
      "tag": null,
      "tag_object": null,
      "commit": "b8322de1ead6444b146382d8959d0b1389faf148",
      "tree": "7b9f6ecd8e7ceb3bd3e57b6352b768873fc37f85",
      "runtime_path": "smart",
      "runtime_tree": "b5d3bcaa8177f869d96415ff23fa827249b78e1a",
      "archive_sha256": "e1907da19d642758581194688a16276d224147f2bcfa83c62f15e8ea0fa5feb6"
    }
  },
  "build_inputs": {
    "source": {
      "owner": "simai/ui-source",
      "commit": "47f0404bacdfa6206fb5f18a1909e8a7521a63b5",
      "tree": "c3c0bfcbe5f9b0a70d6fdefa2553c785ec65b101",
      "archive_sha256": "3dacb1e7b31042b5ece61a53530018899c293da7c52ab73f0e0c18b8549017a2"
    },
    "builder": {
      "owner": "simai/ui-builder",
      "commit": "d805a72a6c9191a97d2ebd8b86899bf2f25a2e93",
      "tree": "dd2c4e8fb38cd2c248aa8a47a279a91964754691",
      "archive_sha256": "34d8edd71ebef2508c099aab5626c37a6ebb171497cc607765a25f5e713e6d9f"
    },
    "legacy_compatibility": {
      "required": false
    }
  },
  "inventory": {
    "utility_rules": 729,
    "utility_families": 227,
    "components": 61,
    "smart_components": 44,
    "recipes": 1
  },
  "exclusions": [],
  "claims": {
    "full_compatible": false,
    "production_ready": false,
    "all_items_ready": false
  }
}
