{
  "schema_id": "simai.framework.release-lock",
  "schema_version": 1,
  "compatibility_id": "ui-6e4eae45efcb-smart-a3c8ee1d4062",
  "status": "bounded",
  "profile": "plain-assets-v1",
  "runtime_sources": {
    "ui": {
      "owner": "simai/ui",
      "tag": null,
      "tag_object": null,
      "commit": "6e4eae45efcb8e9a7df5300bcc4f9eca8dc0a09e",
      "tree": "65cca73ac58da77053a7e4e045035a1cfa6a27b1",
      "runtime_path": "distr",
      "runtime_tree": "22f498a78e105bfb687c5247ccd68a38aacb465d",
      "archive_sha256": "b29bbc716cab63935903350b77e07fa66df75abd569e7c5117544cdab305aced"
    },
    "ui-smart": {
      "owner": "simai/ui-smart",
      "tag": null,
      "tag_object": null,
      "commit": "a3c8ee1d4062ae9690897f061b413cc8077c67b7",
      "tree": "43c2d0df804237d3e398ab3e60b518c217499b7e",
      "runtime_path": "smart",
      "runtime_tree": "e3150203ddf34171c70695cdc6c0910564628c5d",
      "archive_sha256": "8f7f15a0e27ffc97b99679d9108d248e2eb64ccd1b87cd9f6429f8b80c748ac2"
    }
  },
  "build_inputs": {
    "source": {
      "owner": "simai/ui-source",
      "commit": "b61b7366d282a2e732b3d07c50f9d535070c47ea",
      "tree": "cad0603d0ce814b16413d053a6fe54605dee3685",
      "archive_sha256": "3cebc2b4b21f5fdaf99dd6dd06efa95b3303c06e1b553ef5a6ccbaa1051569b5"
    },
    "builder": {
      "owner": "simai/ui-builder",
      "commit": "d805a72a6c9191a97d2ebd8b86899bf2f25a2e93",
      "tree": "dd2c4e8fb38cd2c248aa8a47a279a91964754691",
      "archive_sha256": "34d8edd71ebef2508c099aab5626c37a6ebb171497cc607765a25f5e713e6d9f"
    },
    "legacy_compatibility": {
      "required": false
    }
  },
  "inventory": {
    "utility_rules": 729,
    "utility_families": 227,
    "components": 61,
    "smart_components": 44,
    "recipes": 1
  },
  "exclusions": [],
  "claims": {
    "full_compatible": false,
    "production_ready": false,
    "all_items_ready": false
  }
}
