{
  "schema_id": "simai.framework.release-lock",
  "schema_version": 1,
  "compatibility_id": "ui-6f9137222dbd-smart-a8c44c8e30d0",
  "status": "bounded",
  "profile": "plain-assets-v1",
  "runtime_sources": {
    "ui": {
      "owner": "simai/ui",
      "tag": null,
      "tag_object": null,
      "commit": "6f9137222dbd72b4e23752139f79502c26d29675",
      "tree": "23ac81d08124f0eed30cc732a204937de0099d50",
      "runtime_path": "distr",
      "runtime_tree": "f22cf75e20fa47d160133b5f4b5ff5e7af52d58b",
      "archive_sha256": "887bb0adf6390cf8e618d8478dbf18872561b3bd7bc1e78be1c62dcf8c42e9c9"
    },
    "ui-smart": {
      "owner": "simai/ui-smart",
      "tag": null,
      "tag_object": null,
      "commit": "a8c44c8e30d07836df80b3f54630cae32f52b9ba",
      "tree": "1628f8c9daa9987e716a9495b95e338d6f77e120",
      "runtime_path": "smart",
      "runtime_tree": "9792da7c1d17fb2a9ab91a9e9972e2b12afc5d35",
      "archive_sha256": "a4c6f1615761b11dceb51010287c6147926595a7d9eb6b5b984e862b7e36a72a"
    }
  },
  "build_inputs": {
    "source": {
      "owner": "simai/ui-source",
      "commit": "5490a1db075038f357c081943e8cf7187758780e",
      "tree": "f7de7436e14ad2ff995223b885cc734351c3702f",
      "archive_sha256": "026d1dbd102a813cd20500363d3e7a063945b0a176b53ce35eac03cfa34c4052"
    },
    "builder": {
      "owner": "simai/ui-builder",
      "commit": "d805a72a6c9191a97d2ebd8b86899bf2f25a2e93",
      "tree": "dd2c4e8fb38cd2c248aa8a47a279a91964754691",
      "archive_sha256": "34d8edd71ebef2508c099aab5626c37a6ebb171497cc607765a25f5e713e6d9f"
    },
    "legacy_compatibility": {
      "required": false
    }
  },
  "inventory": {
    "utility_rules": 729,
    "utility_families": 227,
    "components": 61,
    "smart_components": 44,
    "recipes": 1
  },
  "exclusions": [],
  "claims": {
    "full_compatible": false,
    "production_ready": false,
    "all_items_ready": false
  }
}
